<?xml version="1.0" encoding="UTF-8"?>
<flowtran id="" kind="" longname="" package="" xmlns:xsi="http://www.w3.org/2001/XMLSchema-instance" xsi:noNamespaceSchemaLocation="../scheme/NewXMLSchema.xsd">
  <description>description</description>
  <interface class="" package="">
    <input packMode="true"/>
    <output asParm="true" packMode="true"/>
    <property packMode="true"/>
    <printer packMode="true"/>
  </interface>
  <error_prof desc="" id="" longname="" mappingToProperty="true" serviceName="" test="">
    <in_mappings by_interface="true"/>
    <out_mappings by_interface="true"/>
  </error_prof>
  <flow desc="" id="" longname="" test="">
    <case desc="" id="" longname="" test=""/>
  </flow>
  <outMapping by_interface="true">
    <mapping by_interface="true" desc="" dest="" dstype="tran" on_top="true" src=""/>
  </outMapping>
  <propertyToPrinterMapping by_interface="true">
    <mapping by_interface="true" desc="" dest="" dstype="tran" on_top="true" src=""/>
  </propertyToPrinterMapping>
  <outToPrinterMapping by_interface="true">
    <mapping by_interface="true" desc="" dest="" dstype="tran" on_top="true" src=""/>
  </outToPrinterMapping>
</flowtran>
